<?xml version="1.0" encoding="UTF-8"?>
<list xmlns:xsi="http://www.w3.org/2001/XMLSchema-instance" xsi:noNamespaceSchemaLocation="skillTrees.xsd">
	<skillTree type="transformSkillTree">
		<!-- Confirmed CT2.5 -->
		<skill skillName="Transform Onyx Beast" skillIdLvl="617,1" getLevel="50" itemsIdCount="9648,1" />
		<skill skillName="Transform Death Blader" skillIdLvl="618,1" getLevel="55" itemsIdCount="9649,1" preRequisiteSkillIdLvl="617,1" />
		<skill skillName="Transform Grail Apostle" skillIdLvl="541,1" getLevel="60" itemsIdCount="9650,1" race="0" preRequisiteSkillIdLvl="617,1" />
		<skill skillName="Transform Grail Apostle" skillIdLvl="542,1" getLevel="60" itemsIdCount="9650,1" race="1;2;3;4" preRequisiteSkillIdLvl="617,1" />
		<skill skillName="Transform Grail Apostle" skillIdLvl="543,1" getLevel="60" itemsIdCount="9650,1" race="5" preRequisiteSkillIdLvl="617,1" />
		<skill skillName="Transform Unicorn" skillIdLvl="544,1" getLevel="60" itemsIdCount="9651,1" race="1" preRequisiteSkillIdLvl="617,1" />
		<skill skillName="Transform Unicorn" skillIdLvl="545,1" getLevel="60" itemsIdCount="9651,1" race="0;5;3;4" preRequisiteSkillIdLvl="617,1" />
		<skill skillName="Transform Unicorn" skillIdLvl="546,1" getLevel="60" itemsIdCount="9651,1" race="2" preRequisiteSkillIdLvl="617,1" />
		<skill skillName="Transform Lilim Knight" skillIdLvl="547,1" getLevel="60" itemsIdCount="9652,1" race="2" preRequisiteSkillIdLvl="617,1" />
		<skill skillName="Transform Lilim Knight" skillIdLvl="548,1" getLevel="60" itemsIdCount="9652,1" race="0;5;3;4" preRequisiteSkillIdLvl="617,1" />
		<skill skillName="Transform Lilim Knight" skillIdLvl="549,1" getLevel="60" itemsIdCount="9652,1" race="1" preRequisiteSkillIdLvl="617,1" />
		<skill skillName="Transform Golem Guardian" skillIdLvl="550,1" getLevel="60" itemsIdCount="9653,1" race="4" preRequisiteSkillIdLvl="617,1" />
		<skill skillName="Transform Golem Guardian" skillIdLvl="551,1" getLevel="60" itemsIdCount="9653,1" race="0;1;2;5" preRequisiteSkillIdLvl="617,1" />
		<skill skillName="Transform Golem Guardian" skillIdLvl="552,1" getLevel="60" itemsIdCount="9653,1" race="3" preRequisiteSkillIdLvl="617,1" />
		<skill skillName="Transform Inferno Drake" skillIdLvl="553,1" getLevel="60" itemsIdCount="9654,1" race="3" preRequisiteSkillIdLvl="617,1" />
		<skill skillName="Transform Inferno Drake" skillIdLvl="554,1" getLevel="60" itemsIdCount="9654,1" race="0;1;2;5" preRequisiteSkillIdLvl="617,1" />
		<skill skillName="Transform Inferno Drake" skillIdLvl="555,1" getLevel="60" itemsIdCount="9654,1" race="4" preRequisiteSkillIdLvl="617,1" />
		<skill skillName="Transform Dragon Bomber" skillIdLvl="556,1" getLevel="60" itemsIdCount="9655,1" race="5" preRequisiteSkillIdLvl="617,1" />
		<skill skillName="Transform Dragon Bomber" skillIdLvl="557,1" getLevel="60" itemsIdCount="9655,1" race="1;2;3;4" preRequisiteSkillIdLvl="617,1" />
		<skill skillName="Transform Dragon Bomber" skillIdLvl="558,1" getLevel="60" itemsIdCount="9655,1" race="0" preRequisiteSkillIdLvl="617,1" />
		<skill skillName="Transform Heretic" skillIdLvl="670,1" getLevel="70" itemsIdCount="10302,1" preRequisiteSkillIdLvl="617,1" />
		<skill skillName="Transform Veil Master" skillIdLvl="671,1" getLevel="70" itemsIdCount="10303,1" preRequisiteSkillIdLvl="617,1" />
		<skill skillName="Transform Saber Tooth Tiger" skillIdLvl="672,1" getLevel="70" itemsIdCount="10304,1" preRequisiteSkillIdLvl="617,1" />
		<skill skillName="Transform Oel Mahum" skillIdLvl="673,1" getLevel="70" itemsIdCount="10305,1" preRequisiteSkillIdLvl="617,1" />
		<skill skillName="Transform Doll Blader" skillIdLvl="674,1" getLevel="70" itemsIdCount="10306,1" preRequisiteSkillIdLvl="617,1" />
		<skill skillName="Transform Zaken" skillIdLvl="663,1" getLevel="60" itemsIdCount="10295,1" preRequisiteSkillIdLvl="617,1" />
		<skill skillName="Transform Anakim" skillIdLvl="664,1" getLevel="70" itemsIdCount="10296,1" preRequisiteSkillIdLvl="617,1" />
		<skill skillName="Transform Venom" skillIdLvl="665,1" getLevel="70" itemsIdCount="10297,1" preRequisiteSkillIdLvl="617,1" />
		<skill skillName="Transform Gordon" skillIdLvl="666,1" getLevel="76" itemsIdCount="10298,1" preRequisiteSkillIdLvl="617,1" />
		<skill skillName="Transform Ranku" skillIdLvl="667,1" getLevel="76" itemsIdCount="10299,1" preRequisiteSkillIdLvl="617,1" />
		<skill skillName="Transform Kechi" skillIdLvl="668,1" getLevel="76" itemsIdCount="10300,1" preRequisiteSkillIdLvl="617,1" />
		<skill skillName="Transform Demon Prince" skillIdLvl="669,1" getLevel="76" itemsIdCount="10301,1" preRequisiteSkillIdLvl="617,1" />
	</skillTree>
</list>